user_name,user_location,user_description,user_created,user_followers,user_friends,user_favourites,user_verified,text,date,hashtags,source,is_retweet
Brishti Basu,"Victoria, British Columbia",Journalist @CapitalDailyVic | brishti@capitaldaily.ca | Words in a bunch of places | she/her | DMs are open |,8/14/2014 10:06,5295,978,44303,FALSE,"On XBB.1.5/Kraken: It's now 5-6% of known COVID-19 cases in BC; Omicron BA 2 subvariant is still dominant in BC, DB… https://t.co/Rk4UUCNDtR",1/13/2023 20:53,,Twitter Web App,FALSE
Spectrum News NY1,New York City,The 24-hour news network dedicated to NYC. NY1 is also on Facebook (NY1News) and Instagram (NY1).,5/29/2009 22:37,464712,133,2071,TRUE,A highly transmissible new omicron subvariant known as XBB.1.5 accounts for more than 70% of the COVID-19 cases New… https://t.co/fL9G722pvh,1/13/2023 20:39,,SocialNewsDesk,FALSE
Regina Phelps 🇺🇦,"San Francisco, CA","Crisis Management, Exercise Design & Pandemic Planning Expert & Thought Leader, Author, Speaker, Consultant  Respect Science, Respect Nature, Respect Each Other",4/22/2007 12:21,1229,1052,4266,FALSE,#covid19 I love this quote in this STAT article on the latest and greatest subvariant - #XBB.1.5. Maria Van Kerkhov… https://t.co/mz1YIGMbIp,1/13/2023 20:11,"['covid19', 'XBB']",LinkedIn,FALSE
Gulf News,United Arab Emirates,We don't just cover the news - we uncover the truth. The official Twitter feed from Gulf News.,2/11/2009 8:21,1468760,240,1016,TRUE,"#Covid_19: Omicron subvariant XBB.1.5 could be dominant in Europe soon: Health agency 
#XBB15 #XBBvariant 
https://t.co/mx3lzqZtPX",1/13/2023 19:54,"['Covid_19', 'XBB15', 'XBBvariant']",TweetDeck,FALSE
Andy Vermaut,"Diksmuide, België","Linked to WCPDCD,  
RT is not endorsement 
ActNow for Climate 
People Forests 
Fundamental rights Postversa
Whatsapp +32499357495 
denktankcarmenta@gmail.com",4/17/2011 16:39,31422,34258,1914,FALSE,"Andy Vermaut shares:What Is XBB.1.5, The Most Transmissible Covid Subvariant Yet: The Omicron subvariant XBB.1.5, t… https://t.co/hzMR95yNhw",1/13/2023 19:42,,dlvr.it,FALSE
Andy Vermaut,"Diksmuide, België","Linked to WCPDCD,  
RT is not endorsement 
ActNow for Climate 
People Forests 
Fundamental rights Postversa
Whatsapp +32499357495 
denktankcarmenta@gmail.com",4/17/2011 16:39,31422,34258,1914,FALSE,Andy Vermaut shares:Omicron XBB.1.5 Accounts for 43% of US COVID Cases: CDC: The fast-spreading Omicron subvariant… https://t.co/ED2Rwnu35h,1/13/2023 19:36,,dlvr.it,FALSE
NEWSMAX,United States,"Real News for Real People. 

Watch NEWSMAX, an independent news network with a conservative perspective, available in 100M+ U.S. homes: https://t.co/rs8XZDalW3",2/10/2009 21:04,2022769,668,2086,TRUE,The fast-spreading omicron subvariant XBB.1.5 is estimated to account for 43% of the COVID-19 cases in the United S… https://t.co/XINWtOpEqH,1/13/2023 19:15,,Emplifi,FALSE
KUWAIT TIMES,Kuwait,The First English Daily in the Arabian Gulf | Since 1961 | For Arabic News @kuwaitnews,11/8/2011 19:01,45623,2,235,TRUE,"#Omicron subvariant XBB.1.5, which now accounts for a quarter of #US #COVID-19 cases, could become the dominant str… https://t.co/qfePtPDvdk",1/13/2023 18:53,"['Omicron', 'US', 'COVID']",Twitter for iPhone,FALSE
NYC EMS Watch,NYC,"A unique look at FDNY EMS EMTs & Paramedics, NYC EMS life in general, First Responder life everywhere & NYC politics. As always, unofficial, satirical and wry.",5/12/2010 17:39,17507,205,192754,FALSE,"New York City health officials warned Friday that the new XBB.1.5 COVID-19 subvariant ""is the most transmissible fo… https://t.co/ZQrx9rc1nZ",1/13/2023 18:10,,Twitter for Android,FALSE
VERIFY,,VERIFY is dedicated to fighting the spread of misinformation & helping you determine what's true and what's false. Part of @TEGNA.,11/16/2020 19:42,13641,152,315,TRUE,"Here are 4 Fast Facts about the new COVID-19 subvariant of omicron, XBB.1.5: https://t.co/nOxAISRwPO https://t.co/Iu3JRu32AG",1/13/2023 18:00,,SocialNewsDesk,FALSE
GMA News,Philippines,Welcome to the official Twitter account of GMA News in the Philippines.,5/12/2009 7:14,6467985,677,14963,TRUE,The Omicron subvariant XBB.1.5 is the most transmissible of the COVID-19 subvariants to emerge so far and has been… https://t.co/Hs7NPnmwX9,1/13/2023 18:00,,TweetDeck,FALSE
CHAP,"Arlington, VA",Our goal is to revolutionize the accreditation experience. Change the conversation. Advance the highest quality of home and community-based care.,8/5/2011 18:50,809,667,966,FALSE,"CHAP Health Update 1/13/23:
- FDA monitoring emergence of  XBB.1.5 subvariant
- Autopsies Show COVID-19 in Brain an… https://t.co/xf4qP6lbaF",1/13/2023 17:53,,Hootsuite Inc.,FALSE
My Care Labs,"California, USA","My Care Labs helps to counter the spread of #COVID19, #Flu, #RSV, and other diseases through our easy, accurate, no-cost tests.",12/1/2021 23:41,133,47,335,FALSE,"The new Xbb.1.5 subvariant now makes up around 28% of US COVID-19 cases. 
https://t.co/U8bUP4hs8f

Book your all-in… https://t.co/A2iGKPL7zo",1/13/2023 16:43,,Buffer,FALSE
HealthWise,,The online vertical of PUNCH Newspapers dedicated to health and related development stories,12/30/2019 13:38,357,213,912,FALSE,"XBB.1.5: What to know about most transmissible COVID-19 subvarianthttps
https://t.co/ZsiogrJ0AE
@NCDCgov @nmanigeria @Fmohnigeria",1/13/2023 16:36,,Twitter Web App,FALSE
Onward Nigeria,onwardng@gmail.com,I am Nigerian! |News•Marketing Communications•|PR|,7/6/2010 20:32,90944,95,33,FALSE,"XBB.1.5, The Most Transmissible COVID-19 Subvariant Yet https://t.co/eo7XlpY69J https://t.co/wNKHtKzFLN",1/13/2023 16:22,,dlvr.it,FALSE
Strawberry NG News,Nigeria,"Bite-sized news, that keeps you updated.",11/5/2010 10:27,2180,1688,6,FALSE,"The Omicron subvariant XBB.1.5, the most transmissible Covid-19 subvariant so far, is spreading quickly across the… https://t.co/6XGnLWmIgf",1/13/2023 16:21,,dlvr.it,FALSE
Channels Television,Nigeria,Channels Television is the 15-time winner of the 'Best TV station in Nigeria award' and the most-awarded television station in Africa.,3/22/2010 14:29,6137942,189,4786,TRUE,"XBB.1.5, The Most Transmissible COVID-19 Subvariant Yet

https://t.co/zhvEeJqc4L https://t.co/jaGeWisuAM",1/13/2023 16:20,,Twitter Web App,FALSE
Think FM Solutions,London,"We look after the cleaning so you can focus on your business! Commercial office cleaning & facilities management services.

Call 0844 826 4842 for a free quote!",11/30/2017 14:03,1480,240,1438,FALSE,"The highly infectious XBB.1.5 Covid subvariant is expected to drive the next wave of the virus in the UK. 

Protect… https://t.co/eRrOdD7jZg",1/13/2023 16:02,,Hootsuite Inc.,FALSE
News24,South Africa,South Africa's premier online news resource. Follow @TeamNews24 for all the action from our journalists 🇿🇦 SA's most trusted news source - Reuters Institute,5/8/2008 7:45,5231068,728,1232,TRUE,The Omicron subvariant XBB.1.5 is the most transmissible of the Covid-19 subvariants to emerge so far and has been… https://t.co/el4kpzuMgl,1/13/2023 15:45,,Hootsuite Inc.,FALSE
MoonFlower,Oregon ,"#TheResistance 🌊
No DM please. No Lists. Thank you.",1/28/2017 17:29,3349,3834,145449,FALSE,XBB.1.5 on its way to being predominant COVID-19 subvariant https://t.co/JsrhDv9wnN via @OHAOregon,1/13/2023 15:02,,Twitter Web App,FALSE
Erik Robinson,"Portland, Ore.",Communicator for Oregon Health & Science University. Opinions are my own.,2/4/2012 0:17,462,550,997,FALSE,XBB.1.5 on its way to being predominant COVID-19 subvariant https://t.co/yyVr4vivAi via @OHAOregon,1/13/2023 15:01,,Twitter Web App,FALSE
nychealthy,"New York, NY",nycHealthy is the official account of the NYC Department of Health and Mental Hygiene. User Policy: https://t.co/XIPRez1f1h,12/9/2008 18:13,97004,582,7865,TRUE,Omicron subvariant XBB.1.5 now accounts for 73% of all sequenced COVID-19 cases in NYC. XBB.1.5 is the most transmi… https://t.co/tZUt5tKmsn,1/13/2023 14:58,,Twitter Web App,FALSE
AlertsAndNews,Not Finance Advice ,"Market Research, timely alerts, fast news and your command center to take on the markets! Sign up below and try a trial today!",1/9/2017 20:01,1361,228,759,FALSE,$MRNA $JNJ $PFE $BNTX U.S. CDC Says Omicron Subvariant XBB.1.5 Represents 43% Of Total Covid-19 Cases In The United… https://t.co/WmW2FO9pjo,1/13/2023 14:37,,StockTwits Web,FALSE
AInvest Wire,New York,"Fastest free and breaking news in Stocks, Commodities, Forex, Indices, Economy and more.",4/18/2022 12:26,891,5,47,FALSE,"U.S. CDC says omicron subvariant Xbb.1.5 represents 43% of total COVID-19 cases in the United States, as of week en… https://t.co/wEJ41JKVmq",1/13/2023 14:35,,AinvestNews,FALSE
MrSauravThakur ,"Kathmandu,Nepal",⚠️ Lead Developer for @PriapusIQ - Building https://t.co/ddXdE0XA7v and Much More! 💪 Working hard is not a burden; it is an advantage.,12/25/2020 11:25,339,18,63,FALSE,"⚠️  U.S. CDC SAYS OMICRON SUBVARIANT XBB.1.5 REPRESENTS 43% OF TOTAL COVID-19 CASES IN THE UNITED STATES, AS OF WEE… https://t.co/cqBkU3Xq5t",1/13/2023 14:35,,PiQSuite,FALSE
PiQ,On The Wire,"⚠️ News. Commentary. Markets. Geopolitics.

⚠️ Check out our FREE Reuters newsfeed on PiQ Suite at https://t.co/RGP7sot5wA",8/11/2019 11:01,71233,1727,46556,FALSE,"⚠️  U.S. CDC SAYS OMICRON SUBVARIANT XBB.1.5 REPRESENTS 43% OF TOTAL COVID-19 CASES IN THE UNITED STATES, AS OF WEE… https://t.co/xS91EXqSpJ",1/13/2023 14:35,,PiQ-Suite,FALSE
theSun,Petaling Jaya,Breaking news updates from the website of Malaysia's free and largest circulating urban newspaper. Like Thesundaily on Facebook & Instagram.,7/29/2009 1:58,171382,458,3597,FALSE,"The Omicron subvariant XBB.1.5 is the most transmissible of the Covid-19 subvariants to emerge so far.

#theSun… https://t.co/LjYRmXlCEO",1/13/2023 13:32,['theSun'],Twitter Web App,FALSE
anache 🇺🇸 💙 🇺🇦🏳️‍🌈🏳️‍⚧️,Milky Way,"It was ""woke"" people who ended slavery, passed Civil Rights Act, Voting Rights Act, champion woman’s rights, LGBTQ rights. Why the GOP hates them. I am woke!",3/18/2010 19:24,9953,10913,11587,FALSE,WHO urges travellers to wear masks as new variant appears. XBB.1.5 is most transmissible Omicron subvariant detecte… https://t.co/jEbOdCHCtp,1/13/2023 12:58,,Twitter for iPhone,FALSE
shrikant jadhav,,🇮🇳❤️,11/26/2021 1:01,53,189,3629,FALSE,Covid-19: Omicron subvariant XBB.1.5 causes global concern; WHO warns na... https://t.co/nvYVLbaDEm via @YouTube… https://t.co/Y44ExnoJ6A,1/13/2023 11:40,,Twitter Web App,FALSE
Dimsumdaily Hong Kong,Hong Kong,Leading international English news blog which reports breaking news in  Hong Kong and around the world.,9/8/2019 11:59,4232,44,6,FALSE,"HK logs 8,260 COVID-19 cases today,  first 2 local XBB.1.5 subvariant cases detected, 71 more patients pass away https://t.co/aLekQicdGh",1/13/2023 9:20,,Zapier.com,FALSE
WFAA,"Dallas, TX","From our historic coverage of the JFK assassination to highlighting the biggest local stories of each day, WFAA has served North Texas for nearly 75 years.",8/1/2008 20:46,631086,3938,12415,TRUE,XBB.1.5 COVID-19 subvariant: 4 Fast Facts https://t.co/xBonOzevQl,1/13/2023 7:00,,SocialNewsDesk,FALSE
Sam Wong AM (黃樹樑）,"Canberra, Australian Capital Territory","Past Chair, Aust Red Cross(ACT Division); former Principal Pharmacist, TGA, Dept of Health, Aust Government (retired after 37 years). Now a full time Volunteer.",5/9/2013 9:35,679,418,283,FALSE,Masks recommended on long-haul flights by World Health Organization as COVID-19 subvariant XBB.1.5 spreads - ABC Ne… https://t.co/AFso2B7nyv,1/13/2023 6:38,,Twitter for iPhone,FALSE
MR,,,2/24/2012 6:56,3,66,75,FALSE,Chinese foreign ministry spokesperson Wang Wenbin on Monday said the United States should share domestic COVID-19 i… https://t.co/L0irq1Kgmb,1/13/2023 3:09,,Twitter Web App,FALSE
Spectrum News NY1,New York City,The 24-hour news network dedicated to NYC. NY1 is also on Facebook (NY1News) and Instagram (NY1).,5/29/2009 22:37,464712,133,2071,TRUE,The latest COVID-19 strain spreading around the United States could be the most transmissible variant or subvariant… https://t.co/qcMKXpdyuW,1/13/2023 1:00,,SocialNewsDesk,FALSE
Spectrum News 1 BUF,"Buffalo, NY","Spectrum News 1 offers the best 24-hour local news coverage in Buffalo plus weather, sports and your favorite features.",3/24/2009 21:43,30373,376,857,TRUE,The latest COVID-19 strain spreading around the United States could be the most transmissible variant or subvariant… https://t.co/TUdDjHSspE,1/13/2023 0:00,,SocialNewsDesk,FALSE
SoziologIn stand with Ukraine 💙💛,she/her,"'There's a special place in hell for women who don't support other women' (Madeleine Albright).

@SoziologIn@muenchen.social. Views are my own.",7/13/2020 10:52,760,2077,34320,FALSE,"@Wissing 🛑Masken in Zügen abschaffen, absolut falsches Signal!

""XBB.1.5 - the most transmissible Omicron subvarian… https://t.co/F0MmdVCnV4",1/12/2023 23:57,,Twitter for Android,FALSE
TX Capital Tonight,"Austin, TX",Capital Tonight is Spectrum News' statewide live political show airing every weeknight at 7 p.m. Follow us for all your Texas political news!,7/21/2011 15:28,5888,975,459,TRUE,What to know about the XBB.1.5 COVID-19 subvariant https://t.co/ORxLESUJJt,1/12/2023 23:43,,Twitter Web App,FALSE
Spectrum Bay News 9,Tampa Bay area,"Breaking news first in Tampa Bay. Continuous updates and in-depth coverage only @BN9, @BN9weather and @BN9Traffic can provide  |  News. Weather. Now.",11/11/2008 12:03,384550,444,1764,TRUE,The latest COVID-19 strain spreading around the United States could be the most transmissible variant or subvariant… https://t.co/546kubuge8,1/12/2023 23:15,,SocialNewsDesk,FALSE
Kings County REMO #KingsREMO,"Wolfville, Nova Scotia","We are all responsible for Emergency Preparedness. By failing to prepare, you are preparing to fail -- Benjamin Franklin (Account is not monitored 24/7)",1/23/2015 20:45,827,18,794,FALSE,"2023-01-12 Cases of 'Kraken' (XBB.1.5) subvariant of COVID-19 double in one week, PHAC says. PHAC says the same old… https://t.co/btFEpjV24v",1/12/2023 23:00,,Twitter for iPhone,FALSE
OMG Science Briefly,Internet,"A Science community with less noise & more highlights
on @briefly_tldr. Follow for an invite to join our open beta!",9/5/2014 3:07,4580,4946,32012,FALSE,"XBB.1.5: Still more questions than answers on risk of latest omicro... (Ars Technica)

Amid a winter wave of COVID-… https://t.co/xi7k9Nu76C",1/12/2023 22:40,,OMG Science PLOW,FALSE
Nina Wu,Honolulu,Reporter @StarAdvertiser | Health and sustainability issues | Berkeley @UCBSoJ @FletcherSchool grad. Opinions are my own.,11/12/2008 3:01,6771,5573,64806,TRUE,WHO weighs in on Omicron XBB.1.5 subvariant; US extends COVID health emergency https://t.co/KailspQKOI,1/12/2023 22:05,,Twitter Web App,FALSE
VERIFY,,VERIFY is dedicated to fighting the spread of misinformation & helping you determine what's true and what's false. Part of @TEGNA.,11/16/2020 19:42,13641,152,315,TRUE,The latest COVID-19 subvariant spreading across the U.S. is called XBB.1.5. Here's how the symptoms compare to othe… https://t.co/pI3rhdDV47,1/12/2023 22:00,,SocialNewsDesk,FALSE
7News,"Watertown, New York","WWNY TV is a CBS affiliate in Watertown, NY. Its sister stations are WNYF and MeTV. The studio is located on Arcade Street in Downtown Watertown.",11/3/2010 16:31,4928,479,127,FALSE,With the new year comes a new variant of Covid-19.XBB 1.5 is a subvariant of omicron and is highly infectious. A lo… https://t.co/r6pwDe7hTY,1/12/2023 21:46,,SocialNewsDesk,FALSE
Spectrum News 13,"Orlando, FL",#BreakingNews in #Orlando and all of Central Florida. Also at @MyNews13Weather and @MyNews13Traffic — Send breaking news tips: N13-Desk@charter.com,11/13/2008 14:08,266243,2160,2330,TRUE,"The latest COVID-19 strain could be the most transmissible variant or subvariant yet, health experts say. The omicr… https://t.co/5zhUyEPcY1",1/12/2023 21:30,,SocialNewsDesk,FALSE
Spectrum News 1 HV,Hudson Valley,"Spectrum News 1 offers the best 24-hour local news coverage plus weather, sports and your favorite features.",3/29/2010 21:13,13383,280,102,FALSE,"The latest COVID-19 strain spreading around the U.S. is XBB.1.5, an omicron subvariant. It accounts for more than 7… https://t.co/smlI9YBGJ7",1/12/2023 21:25,,SocialNewsDesk,FALSE
Spectrum News 1 Albany,,Spectrum News 1 is a 24-hour local news channel exclusively available to Spectrum customers in the Capital Region.,3/26/2009 3:15,67902,1354,610,TRUE,"The latest COVID-19 strain spreading around the U.S. is XBB.1.5, an omicron subvariant. It accounts for more than 7… https://t.co/TZ62h3UeoP",1/12/2023 21:25,,SocialNewsDesk,FALSE
Spectrum News 1 CNY/S.Tier,"CNY, Northern NY, S. Tier","Spectrum News 1 offers the best 24-hour local news, politics, and weather coverage for Central New York and the Southern Tier. ",2/24/2009 16:09,22865,790,3901,TRUE,"The latest COVID-19 strain spreading around the U.S. is XBB.1.5, an omicron subvariant. It accounts for more than 7… https://t.co/Ip8DnSwVa5",1/12/2023 21:25,,SocialNewsDesk,FALSE
WUSA9,"Washington, DC","Your stop for breaking news, weather & traffic in DC, Maryland & Virginia. Story ideas? Email newstips@wusa9.com. (@CBS, @TEGNA)",7/11/2008 13:19,134288,5229,12068,TRUE,"A new COVID-19 subvariant of omicron, XBB.1.5, is distinctive because of how fast it spreads. It’s quickly outcompe… https://t.co/jQNDoMPEph",1/12/2023 20:33,,SocialNewsDesk,FALSE
My8one3,Tampa,,3/26/2014 19:57,156,510,655,FALSE,XBB.1.5 COVID-19 subvariant: 4 Fast Facts https://t.co/WamcKMJpWq,1/12/2023 19:06,,Jetpack.com,FALSE
my9oh4,Jacksonville Florida,Jacksonville home foe Lockedin Magazine,4/6/2014 17:45,204,450,2590,FALSE,XBB.1.5 COVID-19 subvariant: 4 Fast Facts https://t.co/0mdSl16TRC,1/12/2023 19:06,,Jetpack.com,FALSE
my4oh7.com,,,10/26/2011 14:26,153,238,389,FALSE,XBB.1.5 COVID-19 subvariant: 4 Fast Facts https://t.co/JJcwni2eRd,1/12/2023 19:06,,Jetpack.com,FALSE
LockedIN Magazine,United States,"Since 2011, LockedIN Magazine has been the Where to go spot for locals to find out what’s going on in their neighborhood. From Youth Sports to major Festivals.",10/7/2015 17:09,308,527,1471,FALSE,XBB.1.5 COVID-19 subvariant: 4 Fast Facts https://t.co/BzWR9qej6k,1/12/2023 19:06,,Jetpack.com,FALSE
Spectrum News 1 ROC,"Rochester, NY","Spectrum News 1 offers the best 24-hour local news coverage in Rochester plus weather, sports and your favorite features.",10/27/2008 2:14,82172,442,455,TRUE,The latest COVID-19 strain spreading around the United States could be the most transmissible variant or subvariant… https://t.co/Gi4B3layXE,1/12/2023 19:05,,SocialNewsDesk,FALSE
WGRZ,"Buffalo, NY","2 On Your Side is WGRZ-TV in Buffalo, NY; the news station that holds people in power accountable!",7/3/2008 13:14,213768,2017,3307,TRUE,"A new COVID-19 subvariant of omicron, XBB.1.5, is distinctive because of how fast it spreads. It’s quickly outcompe… https://t.co/mAv3nndWUI",1/12/2023 18:45,,SocialNewsDesk,FALSE
Boomer Bob Rises once Again is a parody,Staying here on Twitter ,NYY NYG NYR fan I’m a parody of me NO SOCIALISTS NO Bros or Squad lunatics. Hands off Biden Harris Pelosi bobnyc59 is suspended I’m Catholic trump for prison,12/28/2019 13:44,4739,5210,27239,FALSE,People don’t care. Elected officials don’t care. This is why it will only continue to become far worse. Deaths are… https://t.co/kVZCzu5KmP,1/12/2023 18:05,,Twitter for iPhone,FALSE
Michael Schwandt (he/him),Vancouver,"Public health physician in Vancouver.
Antiracist ecoanxious xennial numtot.
Tweets on healthy environments, population health, equity, climate.
Views mine.",4/20/2011 15:17,5134,4020,11956,TRUE,"The game has not changed, even while so much reporting/commentary has been focused on what to call the ball for a m… https://t.co/vKsWIXLxuh",1/12/2023 18:03,,Twitter Web App,FALSE
WNEP,Northeastern & Central PA,Your #1 Source for News & Information | Have a news tip? Email: newstip@wnep.com | WNEP-TV (ABC Affiliate) is #ProudtoServe,6/5/2008 15:34,153000,157,1879,TRUE,"VERIFY has put together four fast facts with what you should know about the XBB.1.5 ""kraken"" COVID-19 variant. https://t.co/KnhO7v5bRq",1/12/2023 17:31,,SocialNewsDesk,FALSE
WttippedCreamOnHorsesh!t,Your mom's house,"#shitposter, Pronouns: deez/nutz, They're all in on it. No Amnesty ever! We're coming for all you fuckers.",6/26/2020 16:32,487,941,53841,FALSE,"XBB.1.5 COVID-19 subvariant: 4 Fast Facts https://t.co/YITAcD5wlI via @10TV 

1. Nobody Cares
2. Nobody Cares
3. No… https://t.co/OvKxVciY9n",1/12/2023 17:06,,Twitter Web App,FALSE
IPAC Canada,Canada,"IPAC Canada is a national, multidisciplinary association of Infection Control Professionals dedicated to the health of all Canadians.",12/20/2011 20:44,3571,406,2107,FALSE,"XBB.1.5. in Canada: New COVID-19 subvariant cases have doubled in a week, PHAC says #COVID19 #Variants https://t.co/V1ah7eA7UY",1/12/2023 17:00,"['COVID19', 'Variants']",Hootsuite Inc.,FALSE
WKYC 3News,"Cleveland, OH","Visit https://t.co/aJBBCpGyhK for news, weather, sports and information for the #NortheastOhio #NBC affiliate. #3News",4/3/2008 20:25,200930,17617,10049,TRUE,XBB.1.5 COVID-19 subvariant: 4 Fast Facts https://t.co/TnauPQD5Iz,1/12/2023 16:47,,SocialNewsDesk,FALSE
13News Now,"Norfolk, VA",13News Now is part of @TEGNA and is the ABC affiliate for southeastern Virginia and northeastern North Carolina. Telling the Stories of Now.,1/18/2008 20:42,147918,1949,1925,TRUE,XBB.1.5 COVID-19 subvariant: 4 Fast Facts https://t.co/TQdAiL6tsQ,1/12/2023 16:40,,SocialNewsDesk,FALSE
Teresa Wright,Charlottetown,"National health reporter @globalnews. 15+ yrs covering news and politics, incl with @CdnPressPoli. “Comfort the afflicted and afflict the comfortable.”",9/17/2008 17:00,18057,2732,15200,TRUE,"XBB.1.5. in Canada: New COVID-19 subvariant cases have doubled in a week, PHAC says

https://t.co/QAALIFkSgM

#cdnhealth #COVID19",1/12/2023 16:32,"['cdnhealth', 'COVID19']",Twitter Web App,FALSE
FOX61,"Hartford, CT","Follow us for the latest breaking news, weather, sports, and entertainment. FOX61 News - Expect More.",10/23/2007 16:27,151499,852,2383,TRUE,XBB.1.5 COVID-19 subvariant: 4 Fast Facts https://t.co/l0fflBsACy,1/12/2023 16:23,,SocialNewsDesk,FALSE
Massoud Khazabi,"Ottawa, Ontario","Professor of Economics, University of Ottawa",6/23/2009 17:03,21,29,113,FALSE,"XBB.1.5. in Canada: New COVID-19 subvariant cases have doubled in a week, PHAC says  #CovidIsntOver… https://t.co/BKwwgCLTh2",1/12/2023 16:22,['CovidIsntOver'],Twitter Web App,FALSE
Massoud Khazabi,"Ottawa, Ontario","Professor of Economics, University of Ottawa",6/23/2009 17:03,21,29,113,FALSE,"XBB.1.5. in Canada: New COVID-19 subvariant cases have doubled in a week, PHAC says  #CovidIsntOver… https://t.co/yHddittOp3",1/12/2023 16:22,['CovidIsntOver'],Twitter Web App,FALSE
NEWS CENTER Maine,"Maine, USA","Headlines and breaking news from NBC affiliate NEWS CENTER Maine in Portland and Bangor, Maine. Start your tweet with #NEWSCENTERmaine to say hi!",10/1/2008 1:17,130608,3518,5782,TRUE,XBB.1.5 COVID-19 subvariant: 4 Fast Facts https://t.co/B5uw2GJZh5,1/12/2023 16:20,,SocialNewsDesk,FALSE
Kim Chaney,"Memphis, TN",WATN Digital Content Producer - she/her,3/25/2014 16:40,749,391,5,FALSE,XBB.1.5 COVID-19 subvariant: 4 Fast Facts https://t.co/ztTZ8np12r,1/12/2023 16:10,,SocialNewsDesk,FALSE
9NEWS Denver,"Denver, Colorado","The official Twitter of 9NEWS in Denver, CO. Interact with us! #9NEWSMornings #BeOn9 #9WX We also retweet the #9NEWS team.",1/15/2009 18:32,494408,960,11619,TRUE,XBB.1.5 COVID-19 subvariant: 4 Fast Facts https://t.co/wSKts4HggC,1/12/2023 16:07,,SocialNewsDesk,FALSE
ABC10,"Sacramento, CA","Welcome to ABC10 on Twitter! We are your source for news from Sacramento, Modesto, Stockton, the Sierra Nevada and foothill communities in California.",1/6/2009 1:20,158430,1835,5163,TRUE,XBB.1.5 COVID-19 subvariant: 4 Fast Facts https://t.co/OsZ85OLlip,1/12/2023 16:05,,SocialNewsDesk,FALSE
13 On Your Side,"Grand Rapids, Michigan",We stand up for the community. We want to make life better for everyone. We celebrate all that makes West Michigan unique. We are 13 On Your Side.,8/20/2008 14:04,91711,344,3190,TRUE,XBB.1.5 COVID-19 subvariant: 4 Fast Facts https://t.co/Fm1FMwSl0r,1/12/2023 16:02,,SocialNewsDesk,FALSE
KGW News,"Portland, Oregon","Breaking news, weather, entertainment, & information, for Portland area; NBC affiliate; News tips: newsdesk@kgw.com or TEXT (503) 226-5088 #kgwnews #kgw",3/20/2008 18:11,254828,1225,3894,TRUE,XBB.1.5 COVID-19 subvariant: 4 Fast Facts https://t.co/bV5MYOPvfz,1/12/2023 15:59,,SocialNewsDesk,FALSE
🇮🇳 SA PhD,England,Senior public Health Expert - Data Analysis and Information Management,1/17/2021 23:33,340,810,10552,FALSE,A highly contagious new subvariant of the COVID-19 virus that's fueling rising case numbers in the northeastern Uni… https://t.co/46sUAGNkOa,1/12/2023 15:58,,Twitter for iPhone,FALSE
Tifa,"New Orleans, LA","the black community raises sons they don't want their daughters to be with. if your ANY type of phobic or hate women, move around",4/24/2015 23:49,132,380,88837,FALSE,XBB.1.5 COVID-19 subvariant: 4 Fast Facts https://t.co/Oec6VJDRYy via @WWLTV,1/12/2023 15:54,,Twitter for iPhone,FALSE
WWL-TV,,"Breaking Stories and information from WWL-TV Channel 4, Eyewitness News, CBS affiliate in New Orleans",3/31/2008 21:36,227486,907,13455,TRUE,XBB.1.5 COVID-19 subvariant: 4 Fast Facts https://t.co/AxnTtNiQKE,1/12/2023 15:52,,SocialNewsDesk,FALSE
KTVB.COM,"Boise, ID","Boise and Idaho local news, weather and sports from KTVB, Idaho's #1 news source. Download our app for news & weather alerts: https://t.co/k3UzIoVwgy",5/21/2008 18:08,108422,4414,1251,TRUE,XBB.1.5 COVID-19 subvariant: 4 Fast Facts https://t.co/RohxmXiSl7,1/12/2023 15:51,,SocialNewsDesk,FALSE
