user_name,user_location,user_description,user_created,user_followers,user_friends,user_favourites,user_verified,text,date,hashtags,source,is_retweet
KAGS News,Bryan/College Station. TX,"NBC TV affiliate and Emmy and Murrow award-winning local news station in Bryan, TX. Send breaking news tips at news@kagstv.com.",10/13/2011 18:47,7013,1243,4033,TRUE,XBB.1.5 COVID-19 subvariant: 4 Fast Facts https://t.co/cieDkr7a0g,1/12/2023 15:50,,SocialNewsDesk,FALSE
News19 WLTX,"Columbia, SC","News19 WLTX is On Your Side with Breaking News, Weather and Sports from Columbia, SC. Retweets are not an endorsement. | https://t.co/LZlhk3HLnv",11/14/2008 14:14,126055,3213,18794,TRUE,XBB.1.5 COVID-19 subvariant: 4 Fast Facts https://t.co/ahRN8JWyct,1/12/2023 15:50,,SocialNewsDesk,FALSE
11Alive News,Atlanta,"Welcome to 11Alive: Where Atlanta Speaks. Here, you'll find the top stories and news from 11Alive in Atlanta. Follow us on Facebook: https://t.co/0mK58EWBhr",3/31/2008 19:05,426626,2708,5558,TRUE,XBB.1.5 COVID-19 subvariant: 4 Fast Facts https://t.co/ml1HhqRmwX,1/12/2023 15:50,,SocialNewsDesk,FALSE
13WMAZ News,"Macon, GA",Central Georgia's leading news source. Follow 13WMAZ for the latest breaking news and top headlines.,1/1/2009 13:17,74288,468,1786,TRUE,XBB.1.5 COVID-19 subvariant: 4 Fast Facts https://t.co/rhiFT1uCae,1/12/2023 15:50,,SocialNewsDesk,FALSE
André Picard,,"André Picard is the health columnist at The Globe and Mail. Author of   ""NEGLECTED NO MORE"".
Find me on Mastodon: @picardonhealth@med-mastodon.com",2/15/2011 22:51,136524,1986,2410,TRUE,"What Canadians need to know about the Omicron ‘Kraken’ subvariant XBB.1.5, by @epaultaylor https://t.co/3nq0ToX05a… https://t.co/1AmAhWqkOq",1/12/2023 15:38,,Twitter Web App,FALSE
Corina Flores-H.PhD. Advisor.,Estados Unidos Mexicanos,"Experiencia en Multimodalidad educativa Capacitación online, Salud ocupacional y ambiental . Elaboración de Programas y Proyectos, Innovación English, Portugues",6/23/2012 4:58,16,212,418,FALSE,"The last known subvariant of omicron with a high incidence of covid-19 infections has the sea monster nickname, Kra… https://t.co/f745rqNdeY",1/12/2023 15:31,,Twitter for Android,FALSE
ANews,"Istanbul, Turkey","Perspectives change, truth remains; discover the truth for justice.
Whatsapp: +90 505 199 10 00 | https://t.co/wgoKfje4fJ | https://t.co/hdhijP9jKK | https://t.co/S2nQnoVAtf",10/21/2016 13:00,35148,275,1,FALSE,"Russia on Thursday reported its first case of the new coronavirus XBB.1.5 subvariant, dubbed ""kraken."" #kraken… https://t.co/GfqIdP0Tfz",1/12/2023 15:15,['kraken'],ANews Twitter,FALSE
Pandemia,,All things pandemic focusing currently on COVID-19 or to give it its common name coronavirus.,3/26/2020 22:59,24,42,17,FALSE,WHO weighs in on Omicron XBB.1.5 subvariant; US extends COVID health emergency #Coronavirus #Covid-19 https://t.co/3Yhmfsr8Sj,1/12/2023 15:05,"['Coronavirus', 'Covid']",SocialBee.io v2,FALSE
Val Giddings,,"ITIF life sci guru, professional skeptic, biotech expert, policy wonk, beekeeper, lover of wilderness. will travel miles for dark night skies. opinions my own.",2/5/2013 16:35,5422,5963,62646,FALSE,Masks recommended on long-haul flights by World Health Organization as COVID-19 subvariant XBB.1.5 spreads… https://t.co/yaQsaHFqyd,1/12/2023 14:41,,Twitter Web App,FALSE
News & Record,"Greensboro, NC","Official Twitter feed of the News & Record. Find news, sports, opinion, videos, photos, RTs from journalists. Join the conversation.",1/4/2008 21:04,57176,535,439,FALSE,The Triad is being advised by local infectious diseases experts to brace for another highly contagious COVID-19 omi… https://t.co/eqFhpxO7XO,1/12/2023 14:39,,SocialNewsDesk,FALSE
Madeleine Dumais-Reynolds,,Are you smart enough to take Garlic for COVID,9/7/2022 15:14,736,526,706,FALSE,"XBB.1.5. in Canada: New COVID-19 subvariant cases have doubled in a week, PHAC says https://t.co/M3Wd4llcSM",1/12/2023 14:32,,Twitter Web App,FALSE
ANADOLU AGENCY,Ankara - TÜRKİYE,"News from around the world, digital content, human interest stories by
Anadolu Agency

Also follow
📸+ 🎥: @anadoluimages TR: @anadoluajansi AR: @aa_arabic",1/19/2011 14:45,197032,28,0,TRUE,"Russia reports its first case of new coronavirus XBB.1.5 subvariant, dubbed “kraken”

The variant, another offshoot… https://t.co/i164gsYK0u",1/12/2023 13:10,,aa.com.tr,FALSE
Sir Stavros 🐾,,You cannot erase history by simply saying it didn’t happen.,9/5/2022 13:44,176,267,6376,FALSE,"XBB.1.5. in Canada: New COVID-19 subvariant cases have doubled in a week, PHAC says - National |… https://t.co/gWvCkFid9D",1/12/2023 12:48,,Twitter for iPhone,FALSE
anita fellows4 🌊#bluecrew,,"baby boomer, despise GOP, Trump and his followers, get rid of electoral college, RESISTER, vote blue, main acct @an3ita5🌊 please follow both accts. TY",12/22/2021 12:52,1196,1522,2384,FALSE,"wide-ranging authority over a number of Covid-19-related areas, including data tracking and allowing pharmacists, r… https://t.co/iuv8RAPECj",1/12/2023 12:45,,Twitter Web App,FALSE
🌻🇨🇦 Merlin 🇨🇦 🌻Wear an N95 #COVIDisAirborne,Canada,I am a Maritimer & Albertan but I am a Canadian First. I do not need an effing Sovereignty Act.  I have worn an N95 since Feb 2020. #MaskTheKRAKEN,11/28/2012 23:48,12128,9102,277931,FALSE,"XBB.1.5. in Canada: New COVID-19 subvariant cases have doubled in a week, PHAC says

This is the case and they test… https://t.co/dImh5ULVHR",1/12/2023 12:42,,Twitter for Android,FALSE
Hummingbird,"Maryland, USA","Husband, Father, Grandpa, Honorably Retired Navy Veteran and Democrat. Unalienable rights: Life, Liberty and the Pursuit of Happiness. #BidenHarris 🌊",1/24/2019 3:42,5377,5791,1630,FALSE,Emergence of the Omicron XBB.1.5 subvariant has resulted in a spike in new cases. The latest numbers show that the… https://t.co/mjxddZwne9,1/12/2023 12:04,,Twitter for iPhone,FALSE
Journal World Wide,,"There has been a rapid expansion of Journalworldwide as a source of online news and information. Football, movies, and video games are all covered on the site,",6/23/2022 3:55,1,0,0,FALSE,New Covid Subvariant: A newly discovered COVID-19 subtype is rapidly spreading around the world. The XBB.1.5 strain… https://t.co/D8jwOy9baf,1/12/2023 11:26,,Blog2Social APP,FALSE
U.S. News & World Report,"Washington, D.C.","Life’s decisions made here since 1933. Breaking news and analysis, consumer advice and the original rankings guide.",6/4/2007 19:19,171664,704,607,TRUE,"The highly transmissible omicron subvariant XBB.1.5 is threatening to drive a global increase in coronavirus cases,… https://t.co/DYyIPbxne6",1/12/2023 11:01,,Naytev,FALSE
Sebastian Kraemer 💙 #EndFossil,London,employed continuously and only in the National Health Service from 1970 to 2015. 'Mean societies produce mean people' https://t.co/iO2maDNOlt,7/21/2011 19:46,2526,4838,10987,FALSE,"""XBB.1.5 - the most transmissible Omicron subvariant detected so far - accounted for 27.6% of COVID-19 cases in the… https://t.co/T0sBt8Wg6q",1/12/2023 9:30,,Twitter for iPad,FALSE
Microbes.info,Earth,"Tweeting and RT-ing microbiology news, articles and comments relevant to aspects on bacteria, fungi, viruses and other microbes / microorganisms. Microbes are 💪",4/12/2019 20:42,1504,516,15774,FALSE,"#COVID-19 #coronavirus #omicron XBB.1.5 #subvariant may be spreading in #Florida ... 

| #COVID19 | #PublicHealth |… https://t.co/fyIckukh95",1/12/2023 8:00,"['COVID', 'coronavirus', 'omicron', 'subvariant', 'Florida', 'COVID19', 'PublicHealth']",Buffer,FALSE
Expat Life in Indonesia,"Jakarta Capital Region, Indone",Expat Living Guide for Indonesia,7/26/2020 16:09,104,363,0,FALSE,"The Covid-19 virus has mutated again. In circulating reports, the newest variant, the Omicron XBB.1.5 subvariant or… https://t.co/irpzGXbo35",1/12/2023 5:40,,TweetDeck,FALSE
The Royal Melbourne Hospital,"Parkville, Victoria, Australia","Advancing care for everyone, every day. For 24 hour support or in an emergency call 000.",4/4/2009 2:47,13758,510,4203,TRUE,There is a lot of talk at the moment about the new Omicron subvariant XBB.1.5. But what exactly is it? Infectious D… https://t.co/rZVWHUCrJw,1/12/2023 5:30,,Twitter Web App,FALSE
Los Angeles Times,"El Segundo, CA",News from a West Coast perspective.,10/9/2008 11:07,3998742,6886,3337,TRUE,"It’s unclear whether the circulation of this latest strain, XBB.1.5, will alter the trajectory of the COVID-19 pand… https://t.co/MD4Uq7tcce",1/12/2023 5:12,,SocialNewsDesk,FALSE
Indians in Kuwait (IndiansinKuwait.com),Kuwait,"Indians in Kuwait, popularly known as IIK is the most preferred news destination for the expatriate community in Kuwait.  Visit us for all India Kuwait news",12/21/2009 11:15,11410,12,1,FALSE,"XBB.1.5 COVID variant detected in Kuwait
 
 - The ministry of health announced Wednesday that genetic tests have de… https://t.co/8cLWYdp7Ox",1/12/2023 4:08,,dlvr.it,FALSE
Canoe,Canada,"News, sports, entertainment, lifestyle, travel and tech, from one of Canada's largest general interest websites.",5/14/2007 17:26,8477,2015,1672,TRUE,"COVID-19 subvariant Kraken is spreading in Quebec, new figures show https://t.co/6Hi5TvdE3C",1/12/2023 3:31,,Echobox,FALSE
Betty C. Jung,United States,"Betty C. Jung MPH RN MCHES® Adjunct lecturer, Public Health; PHENOM Director; Webmaster #PublicHealth #Health #Science #Technology #Culture #COVID19",3/1/2010 19:12,1095,202,2931,FALSE,XBB.1.5 - the most transmissible Omicron subvariant detected so far - accounted for 27.6% of COVID-19 cases in the… https://t.co/LVuBwElpOn,1/12/2023 3:02,,Twitter Web App,FALSE
Democrat-Herald,Albany,"Your source for news in Albany, Oregon.",1/13/2009 17:55,3352,193,160,FALSE,The World Health Organization has called the XBB.1.5 subvariant the most transmissible so far. https://t.co/fsr5Qfv8Tn,1/12/2023 2:54,,SocialNewsDesk,FALSE
GazetteTimes.com,"Corvallis, OR","Your source for news and information in Corvallis, Oregon and the mid-Willamette Valley",8/14/2008 18:27,6859,1001,214,FALSE,The World Health Organization has called the XBB.1.5 subvariant the most transmissible so far. https://t.co/5YJfsf2ubt,1/12/2023 2:52,,SocialNewsDesk,FALSE
Bruno J. Navarro,"New York, USA","@bruno_j_navarro@mastodon.lol | newsroom veteran, fledgling cellist, former emt | he/they | ex @CNBC, @WWD, @TODAYshow, @NBCNews, @AP, @azcentral",6/3/2010 20:16,7495,9999,237002,TRUE,"Amid a winter wave of COVID-19 in the US, the latest coronavirus omicron subvariant, XBB.1.5, is revealing more que… https://t.co/zqxREmg9dc",1/12/2023 2:13,,Twitter for iPhone,FALSE
Public Health - Seattle & King County,"Seattle & King County, WA","Public Health - Seattle & King County works to protect and improve the health and well-being of all people in King County, WA.",5/18/2010 0:05,42531,886,2369,TRUE,@UWMedicine discusses new XBB.1.5 #COVID subvariant. New #COVID19 sub-variants have led to COVID-19 surges in the p… https://t.co/pT157397Bt,1/12/2023 2:00,"['COVID', 'COVID19']",Twitter Web App,FALSE
Max Powers,"Sea Isle City, NJ","OV1 -25. I’m an Octogenarian, I want dRUMPf 4 PRISON; Pop-Pop to 12, Dad to 5; BLM, LGBTQ,, SCIENCE IS REAL! Followed by BDD, @Ironhorse76. BLOCK TROLLS,MAGA",8/31/2018 19:14,10930,11828,1720,FALSE,"WHO weighs in on Omicron XBB.1.5 subvariant; US extends COVID health emergency | CIDRAP

XBB.1.5 continues apace. W… https://t.co/UWjvWg9fqB",1/12/2023 0:55,,Twitter for iPhone,FALSE
gene,Japan,"Covid hasn’t given up all its secrets. Here are 6 mysteries experts hope to unravel
https://t.co/0kQIAWSjtD…",5/25/2020 6:41,111,157,1761,FALSE,WHO weighs in on Omicron XBB.1.5 subvariant; US extends COVID health emergency https://t.co/XYa9aLJazq,1/12/2023 0:50,,Twitter Web App,FALSE
Healthy Torontonians,"Toronto, Ontario",Towards a Healthy Life!,9/24/2016 23:32,93,52,0,FALSE,"XBB.1.5. in Canada: New COVID-19 subvariant cases have doubled in a week, PHAC says https://t.co/Et4ku6ieuW https://t.co/BexJefzxlZ",1/12/2023 0:32,,dlvr.it,FALSE
Immunisation Coalition,"Melbourne, Australia",The Immunisation Coalition is an Australian not for profit advocacy group with a mission to create awareness for the importance of immunisation,1/30/2013 1:03,1102,1500,923,FALSE,Masks recommended on long-haul flights by World Health Organization as COVID-19 subvariant XBB.1.5 spreads… https://t.co/Qeqyz5eQ23,1/12/2023 0:06,,Twitter Web App,FALSE
Sam Wong AM (黃樹樑）,"Canberra, Australian Capital Territory","Past Chair, Aust Red Cross(ACT Division); former Principal Pharmacist, TGA, Dept of Health, Aust Government (retired after 37 years). Now a full time Volunteer.",5/9/2013 9:35,679,418,283,FALSE,Masks recommended on long-haul flights by World Health Organization as COVID-19 subvariant XBB.1.5 spreads - ABC Ne… https://t.co/TpfboKIRW0,1/11/2023 23:27,,Twitter for iPhone,FALSE
OSAP.org,"Atlanta, GA","The Organization for Safety, Asepsis and Prevention promotes infection prevention & safety policies & practices to the global dental community.",2/17/2010 15:24,1321,678,289,FALSE,WHO weighs in on Omicron XBB.1.5 subvariant; US extends COVID health emergency https://t.co/yih1sCpb4N,1/11/2023 22:57,,Twitter Web App,FALSE
URNewz.net,,,8/11/2022 2:00,61,62,0,FALSE,"XBB.1.5. in Canada: New COVID-19 subvariant cases have doubled in a week, PHAC says #news #health https://t.co/yjbhZfPknG",1/11/2023 22:46,"['news', 'health']",urnewz.net prod,FALSE
Global National,Watch online,"The most informative half-hour in Canada. Weeknights with @DFriesenGlobal. For breaking news, follow @globalnews.",11/27/2008 18:07,259787,429,1593,TRUE,"XBB.1.5. in Canada: New COVID-19 subvariant cases have doubled in a week, PHAC says https://t.co/oO1VMpX7Xq https://t.co/Rgu8XgRJgo",1/11/2023 22:32,,dlvr.it,FALSE
Globalnews.ca,,Breaking Canadian news with a fresh perspective on local & international headlines 🚨YT: https://t.co/ZNfHkcqrqK 🚨 TikTok: https://t.co/kAUcasXShd,2/22/2010 17:53,830963,298,12701,TRUE,"The number of confirmed cases of the COVID-19 XBB.1.5. subvariant has reached a total of 42 cases as of Monday, the… https://t.co/V3bHWVTAEG",1/11/2023 22:31,,SocialFlow,FALSE
Julio Marchi © Speaks Out,United States,"Technology Scientist, Executive & Entrepreneur. Startup Aficionado. Software Engineer. Publisher & Journalist Enthusiast. Passionate Storyteller & Musician.",5/4/2009 18:08,5964,5343,542,FALSE,"New, more transmissible COVID-19 subvariant XBB.1.5 on the rise - WPVI-TV

-- News | The Perfect Enemy:… https://t.co/cEpddM1zxC",1/11/2023 22:21,,Omnihanded Interactive News,FALSE
Mr. Skanner,NY,"A lone wolf that reads, learns, and shares for those willing to expand their horizons and break free from mainstream media and their own little centrist bubble.",7/22/2012 2:32,299,1291,14,FALSE,"New, more transmissible COVID-19 subvariant XBB.1.5 on the rise - WPVI-TV

-- News | The Perfect Enemy:… https://t.co/nuQzXdTd98",1/11/2023 22:21,,Omnihanded MrSkanner App,FALSE
Amesh Adalja,"Pittsburgh, Baltimore, NYC","Infectious disease MD (also CCM & EM) focused on pandemics, emerging infections, biosecurity, biotech https://t.co/0U7G1vKrK6",12/16/2010 20:41,39584,2143,5029,TRUE,“More than 82% of XBB.1.5 sequences are from US”  https://t.co/q65vnnvqPV,1/11/2023 22:13,,Twitter for iPad,FALSE
Liz Szabo,"Washington, D.C.","Senior correspondent at Kaiser Health News. I normally cover the quality of medical care for seniors. Now, I cover COVID-19. She/Her RTs aren't endorsements.",6/17/2009 20:51,70343,40721,38874,TRUE,WHO weighs in on Omicron XBB.1.5 subvariant; US extends COVID health emergency https://t.co/ELMpZVnNT0,1/11/2023 22:11,,Twitter for iPhone,FALSE
CIDRAP,"Minneapolis, MN",the Center for Infectious Disease Research and Policy at the University of Minnesota,4/29/2009 16:56,36004,327,1449,TRUE,"WHO weighs in on Omicron XBB.1.5 subvariant; US extends #COVID health emergency

The WHO included a caveat that the… https://t.co/ZbjoqJFoX3",1/11/2023 21:57,['COVID'],Hootsuite Inc.,FALSE
Crawford Kilian,"North Vancouver, BC",Retired college teacher & persistent writer. Now on Substack https://t.co/ZI2mFCndIM Born 1941 (CO2 ppm: 310). Polio survivor.,1/15/2009 22:39,10658,4203,5937,FALSE,WHO weighs in on Omicron XBB.1.5 subvariant; US extends COVID health emergency https://t.co/gvwfJTZacy,1/11/2023 21:53,,Twitter Web App,FALSE
Los Angeles Times,"El Segundo, CA",News from a West Coast perspective.,10/9/2008 11:07,3998742,6886,3337,TRUE,"XBB.1.5 “is the most transmissible subvariant that has been detected yet,” said Dr. Maria Van Kerkhove, the World H… https://t.co/U0tiOzNuXu",1/11/2023 20:45,,SocialNewsDesk,FALSE
Cape Argus,"Cape Town, South Africa","Cape Town's oldest daily newspaper, bringing you the news since 1857. We publish in the morning and afternoon and online. Visit our Facebook page to comment.",11/8/2010 4:45,49699,820,394,FALSE,ICYMI: The National Health Department said it would not be imposing any travel restrictions or internal measures af… https://t.co/YSPTOrkyXK,1/11/2023 20:43,,Echobox,FALSE
Daily Maverick,South Africa,"The need to Defend Truth has never been greater. Support free, fair, fearless reporting. Become a Maverick Insider: https://t.co/ifFGQCBOOD",9/4/2009 17:58,553139,1907,192,TRUE,"Looking at information from the US, the ‘incredibly transmissible’ XBB.1.5 subvariant of Omicron might become the d… https://t.co/Zm73FmUwpN",1/11/2023 20:41,,Echobox,FALSE
Sofia Rita Belmonte,Canberra,(CCCD) - (CBL-C-B12) Patient HRS Pioneer of Proven Combined Cobalamin C (MMA with HCU) Metabolic IEM Genetic  Defect. E Activist.,12/11/2015 23:31,616,3818,21175,FALSE,"BE AWARE 
A new COVID-19 variant has been detected in Australia called XBB.1.5. Here’s what experts say about it… https://t.co/ZaS23kYnUB",1/11/2023 20:32,,Twitter Web App,FALSE
Hickory Daily Record,"Hickory, NC",Serving the Catawba Valley region for 100 years. Send news tips to news@hickoryrecord.com & sports@hickoryrecord.com,5/4/2009 17:58,8447,205,0,FALSE,The Triad is being advised by local infectious diseases experts to brace for another highly contagious COVID-19 omi… https://t.co/ozwVQWD4xD,1/11/2023 20:17,,SocialNewsDesk,FALSE
ProMED-EAFR,Anglophone Africa,"ProMED-EAFR is a sub-regional initiative of ProMED-mail focusing on emerging diseases in humans, animals and crops in Anglophone Africa",8/4/2010 20:02,423,6,0,FALSE,"PRO/EAFR&gt; COVID-19 update (01): South Africa, new omicron subvariant, XBB.1.5 https://t.co/SIYTzYC0H7",1/11/2023 20:01,,Zapier.com,FALSE
Nat'l Urban League,New York,"The National Urban League is the nation's largest historic civil rights + urban advocacy org., devoted to empowering communities + changing lives since 1910.",2/19/2009 15:35,109486,1943,8338,TRUE,"COVID-19 hospitalizations have shot up 70% nationwide in recent weeks. There's also a new Omicron subvariant, XBB.… https://t.co/Nvt79Y6RpD",1/11/2023 19:36,,Twitter Web App,FALSE
Dan Levy,Toronto,Tech Aficionado. Problem Solver. Renaissance Guy. Puts Words Together Good. Photographer. @GiftofLife Donor & Ambassador. https://t.co/wEw5Soqhl3,12/17/2008 4:58,6906,1605,11906,FALSE,"I totally missed the discovery of this new Omicron subvariant

Who informally named it ""Kraken""? Are we naming all… https://t.co/3GoUwfjAol",1/11/2023 19:36,,Twitter Web App,FALSE
Genevieve Poole,,,9/16/2020 15:39,1177,4999,63387,FALSE,"It was nuts to remove the mask mandate for flights in the first place

Mandate Masks 😷 

Masks recommended on long-… https://t.co/hgdmTJEyCP",1/11/2023 19:32,,Twitter Web App,FALSE
S,Wild Blue Yonder,"#StandWithUkraine. COVID deniers spreading misinformation! followed by Dworkin, GLENN KIRSCHNER. vaccinated. COVID is Airborne! f Putin",1/26/2014 3:29,5683,6064,274407,FALSE,"This renewal comes as a more transmissible COVID-19 omicron subvariant makes its way across the Northeast. XBB.1.5,… https://t.co/kYDMg5Xzp4",1/11/2023 19:08,,Twitter for iPad,FALSE
Richard Craver,,"Winston-Salem Journal senior business, healthcare and N.C. General Assembly reporter since January 2003.",2/8/2010 17:41,879,8,4,FALSE,The Triad is being advised by local infectious diseases experts to brace for another highly contagious COVID-19 omi… https://t.co/ROfFenukoS,1/11/2023 18:52,,Twitter Web App,FALSE
Winston-Salem Journal,"Winston-Salem, N.C.","Your local news source for Winston-Salem & Northwest North Carolina, since 1897. #wsnc",3/9/2009 19:12,61118,910,701,FALSE,The Triad is being advised by local infectious diseases experts to brace for another highly contagious COVID-19 omi… https://t.co/PLQnzcAnKM,1/11/2023 18:42,,SocialNewsDesk,FALSE
KVOA News 4 Tucson,"Tucson, Arizona","Broadcasting live from Tucson, Arizona.",11/20/2008 23:17,87374,1596,1948,TRUE,Wednesday's renewal comes amid the emergence of the Omicron XBB.1.5 subvariant. https://t.co/QuzU7P5cHh,1/11/2023 18:30,,SocialNewsDesk,FALSE
Instopic,,"All the hot topics, instantly! Generated by AI and Machine Learning. Help by voting on the quality of articles. All images generated by Dall•E2.",12/22/2022 7:29,1,2,0,FALSE,"South Africa steps up testing and monitoring in response to the discovery of the XBB1.5 subvariant, while universit… https://t.co/C3UXVsi34G",1/11/2023 18:10,,instopic_post,FALSE
WSIL News,"Carterville, IL","News 3 WSIL serves viewers in southern Illinois, southeast Missouri and western Kentucky.",2/24/2009 22:41,38166,239,251,TRUE,Wednesday's renewal comes amid the emergence of the Omicron XBB.1.5 subvariant. https://t.co/gj2EFIZqgw,1/11/2023 18:05,,SocialNewsDesk,FALSE
Liz 😒😷,,"GenX, lifelong atheist, liberal, Pet Shop Boys, Britney & Hello Kitty addict, misanthropic, anti-natalist, militantly childfree & pro-choice.",2/20/2010 8:57,2504,2351,214663,FALSE,Masks recommended on long-haul flights by World Health Organization as COVID-19 subvariant XBB.1.5 spreads… https://t.co/UX5KiOWE4Y,1/11/2023 17:30,,Twitter Web App,FALSE
CBS Austin,"Austin, Texas","News, weather and sports updates from CBS Austin in Austin, Texas.",4/29/2008 23:00,116682,13100,2921,TRUE,"The COVID-19 omicron subvariant XBB. 1.5 has been officially identified in Austin-Travis County, according to the A… https://t.co/iylGVwmxwN",1/11/2023 17:09,,TweetDeck,FALSE
Montreal Gazette,"Montreal, QC","Follow for features, news and to-the-minute updates on developing stories. Join the conversation.",8/5/2009 16:21,253279,363,725,TRUE,"COVID-19 subvariant Kraken is spreading in Quebec, new figures show https://t.co/O1JjRSTWAM",1/11/2023 16:42,,Echobox,FALSE
Newbe Lyn,,自媒体,5/27/2022 16:12,10,36,4,FALSE,"New Omicron subvariant XBB.1.5 is spreading quickly in the United States, and is estimated to account for nearly 30… https://t.co/aaV50acixz",1/11/2023 15:46,,Publer.io,FALSE
Val Giddings,,"ITIF life sci guru, professional skeptic, biotech expert, policy wonk, beekeeper, lover of wilderness. will travel miles for dark night skies. opinions my own.",2/5/2013 16:35,5422,5963,62646,FALSE,Masks recommended on long-haul flights by World Health Organization as COVID-19 subvariant XBB.1.5 spreads… https://t.co/GT00Ipv9Ut,1/11/2023 15:27,,Twitter Web App,FALSE
Gate 15,United States of America,"Risk Management: Info / Threat Analysis, Operations, Preparedness & Critical Infrastructure Security & Resilience https://t.co/vrCkP4dQVt",5/5/2014 18:01,2349,3039,25125,FALSE,Europe sees small but growing presence of COVID XBB.1.5 subvariant https://t.co/wBNqjXgnYL #COVID,1/11/2023 14:56,['COVID'],Twitter for Mac,FALSE
Deming Headlight,"Deming, New Mexico","Your information resource for news, sports, and entertainment in Deming, and Southwestern New Mexico.",9/24/2010 18:04,2137,219,180,TRUE,New COVID-19 subvariant XBB.1.5 arrives in New Mexico.#COVID19 #CovidIsNotOver  https://t.co/uYTh5cb2Qc,1/11/2023 14:38,"['COVID19', 'CovidIsNotOver']",Twitter Web App,FALSE
Jess,Covid Free Zone ,Lover of all animals. Nature admirer. Elderly advocate. Bookworm. Sarcastic & compassionate. Music lover. Fierce Mama bear. #WeNotMe #COVIDISAIRBORNE,6/7/2011 2:46,28982,5215,169709,FALSE,"New Brunswick reports 9 COVID-19 deaths, confirms 1st cases of new Omicron subvariant XBB.1.5 https://t.co/sgL33NpM7L",1/11/2023 14:23,,Twitter for iPhone,FALSE
Andy_Weeble_Weaver💙⚫🥀🦡🐿️🌍😷💉×4,"Perry, Birmingham, Gaia","Squirrel Herder,
Iconoclast,
Rejoiner,
Republican,
Brummie,
Atheist,
(Lapsed Solipsist),
Human,
Xenophile.

@andyweaver@mastodonapp.uk",3/30/2019 17:05,4181,5001,405749,FALSE,"""Masks recommended on long-haul flights by World Health Organization as COVID-19 subvariant XBB.1.5 spreads""

•XBB.… https://t.co/yO8E5gaRUa",1/11/2023 13:41,,Twitter for Android,FALSE
Pandemia,,All things pandemic focusing currently on COVID-19 or to give it its common name coronavirus.,3/26/2020 22:59,24,42,17,FALSE,Europe sees small but growing presence of COVID XBB.1.5 subvariant #Coronavirus #Covid-19 https://t.co/gSttW2w7vp,1/11/2023 13:05,"['Coronavirus', 'Covid']",SocialBee.io v2,FALSE
Chris Jones,"Newcastle, New South Wales",I am an enemy of China Communist Party and everything it stands for. I promote the Rights of citizens and hope for a new vital Government of and for the people.,9/21/2011 9:43,848,228,7679,FALSE,Masks recommended on long-haul flights by World Health Organization as COVID-19 subvariant XBB.1.5 spreads - ABC Ne… https://t.co/GAUchHO4V4,1/11/2023 13:04,,Twitter Web App,FALSE
Sandbird,Greece,Love coding,11/8/2010 22:15,1378,707,25978,FALSE,"Europe sees small but growing presence of COVID XBB.1.5 subvariant

WHO European office said data from countries in… https://t.co/L74weX7dFN",1/11/2023 12:53,,Twitter Web App,FALSE
