user_name,user_location,user_description,user_created,user_followers,user_friends,user_favourites,user_verified,text,date,hashtags,source,is_retweet
Paul Phillips,,,4/24/2016 15:20,117,429,7381,FALSE,"What to know about XBB.1.5, a new and highly transmissible COVID-19 subvariant https://t.co/3o0eQ8SsFF",1/20/2023 2:44,,Twitter Web App,FALSE
Barry,Chester Basin,waiting for spring,1/26/2013 23:05,65,712,6958,FALSE,"What to know about XBB.1.5, a new and highly transmissible COVID-19 subvariant https://t.co/EVaW2Q9NAZ",1/19/2023 23:09,,Twitter for Android,FALSE
The People's Response Network to COVID-19(PRN)💉😷,"Chicago, IL",Working to erase Chicago's racial disparities in mitigating COVID-19 by rebuilding Chgo's public health infrastructure via Ordinance (O2021-1214).,4/2/2021 21:05,529,1425,7323,FALSE,The World Health Organization on Friday updated its mask guidance as the highly contagious omicron subvariant XBB.1… https://t.co/pVh2pV4o9t,1/19/2023 21:53,,Twitter for iPad,FALSE
StephanieCzekalinski,"Cleveland, Ohio",Journalist's journalist. Unpublished novelist. Undercover poet. Long live kitchen anarchy!,7/19/2011 14:43,950,1630,1820,TRUE,"XBB.1.5 is a new omicron subvariant that last week accounted for about 43% of cases nationwide, according to the Ce… https://t.co/Byuf9pgvLo",1/19/2023 21:39,,Twitter Web App,FALSE
expertbeans,"Assam, India",Learning Full stack web development📈,5/18/2022 15:02,86,31,1704,FALSE,"What to know about XBB.1.5, a new and highly transmissible COVID-19 subvariant #UI via https://t.co/o6bovrSR1D https://t.co/PNE2rED5SU",1/19/2023 21:30,['UI'],TwinyBots,FALSE
Air Medical Today,USA,Air Medical News & Information with Podcasts,2/4/2009 14:34,5828,453,4,FALSE,"What to know about XBB.1.5, a new and highly transmissible COVID-19 subvariant | PBS NewsHour… https://t.co/9jDpPtSxhA",1/19/2023 21:30,,Buffer,FALSE
Daman Beatty,"Surrey, BC",Creative takin pics. drawing. enjoying life,5/23/2008 12:15,11997,11341,12094,FALSE,"A new Covid-19 omicron subvariant, XBB.1.5, is sweeping the country. https://t.co/X88Pxe7YNg",1/19/2023 19:14,,Twitter for iPhone,FALSE
🌎 🌍 ☮️ Carl Doss,"California, USA, Earth",“One Race the Human Race”  “Be The Change 4 Equality”,9/14/2008 20:27,18806,20689,265399,FALSE,"What to know about XBB.1.5, a new and highly transmissible COVID-19 subvariant https://t.co/xJZ4qtbQYy",1/19/2023 18:14,,Twitter for iPhone,FALSE
Tompkins County Whole Health,"Ithaca, NY",Tompkins County Whole Health provides public health and mental health programs and services for Tompkins County residents.  (607) 274-6600 or (607) 274-6200.,5/24/2018 15:10,3314,440,1712,FALSE,"Health Alert: COVID-19 Subvariant of Concern Omicron XBB.1.5; Boosters Urged
The newest COVID-19 Omicron subvariant… https://t.co/5c5YvGmPPN",1/19/2023 17:55,,Twitter Web App,FALSE
Brianna Wu,"Dedham, MA",Executive Director of @rebellionpac. Former Candidate for US House in MA. Software engineer. Like to go fast. 🏎🏍🏃🏻‍♀️🎮 brianna@hey.com,11/9/2008 4:14,143163,7667,287660,TRUE,"Uhhh. The vaccines barely work against the new variant, and no one is talking about it? 

https://t.co/ey4quihPue https://t.co/qm2q6FedZC",1/19/2023 17:38,,Twitter for iPhone,FALSE
Dr Imran Sheikh 🩺,"Rotterdam, The Netherlands.","MD  MS FACP Neurosurgeon
ICR researcher in Cancer Genomics. #KCL Alumni. #NHS reg Dr. CRUK 
https://t.co/oxznFwqqLA research lead. Currently relate with Erasmus MC",11/22/2011 23:51,16023,14193,19271,FALSE,Americans 65 and older are dying at disproportionately higher rates from COVID-19. Add to this the yet-to-be-fully… https://t.co/6Gh7IQx6KD,1/19/2023 15:48,,Twitter Web App,FALSE
Amesh Adalja,"Pittsburgh, Baltimore, NYC","Infectious disease MD (also CCM & EM) focused on pandemics, emerging infections, biosecurity, biotech https://t.co/0U7G1vKrK6",12/16/2010 20:41,39584,2143,5029,TRUE,"“Within the U.S., there is wide geographic variation in the proportion of cases caused by XBB.1.5, ranging from sev… https://t.co/gfeMgvPC2E",1/19/2023 15:43,,Twitter for iPad,FALSE
Healthcare-Global😷,Canada,"Global Healthcare venue for tracking & trending⏩Rx ,recalls, technology, studies, treatments, outbreaks, and more💗💊💉🚑",2/3/2019 0:33,2001,4973,6815,FALSE,Europe sees small but growing presence of COVID XBB.1.5 subvariant https://t.co/WldFPwuSty,1/19/2023 15:12,,Twitter Web App,FALSE
NiagaraOHT,"Niagara, Ontario","Exceptional, connected care, now and for future generations. For emergencies call 9-1-1. #HealthyTogether",9/13/2019 18:10,492,1327,100,FALSE,@PublicHealthON data shows the XBB.1.5 subvariant (Kraken) could soon account for nearly a quarter of new COVID-19… https://t.co/G0HWqmwrRm,1/19/2023 14:59,,Meltwater Social,FALSE
🇮🇳 SA PhD,England,Senior public Health Expert - Data Analysis and Information Management,1/17/2021 23:33,340,810,10552,FALSE,Omicron subvariant XBB.1.5 now accounts for 73% of all sequenced COVID-19 cases in NY https://t.co/EpMZh60ZF7,1/19/2023 14:59,,Twitter for iPhone,FALSE
Moshe Vardi,"Professor, Rice U., Houston",My mastodon account: @vardi@fediscience.org,4/26/2008 1:58,12435,90,4692,FALSE,"What to know about XBB.1.5, a new and highly transmissible COVID-19 subvariant - PBS NewsHour https://t.co/8azfAeXSiC via @GoogleNews",1/19/2023 14:17,,Twitter Web App,FALSE
Swaggering Toward Bethlehem,,For the many. Mastodon: @kindandunblind@ohai.social,9/14/2011 17:57,3632,2904,8967,FALSE,OREGON: Oregon health officials reported a 16% drop in newly identified coronavirus cases this week and an 9% drop… https://t.co/a4w1zHvzA7,1/19/2023 14:05,,Twitter Web App,FALSE
#InTuneWithYOU,North West Province,Commercial Radio Station| News | Lifestyle | Trends |  89.8-103.9 North West and parts of Gauteng. Channel 842 on DSTV📻 get YOU CHAT & YOU CONNECT apps.,3/19/2014 10:11,21448,1492,1922,FALSE,Update: Second case of XBB.1.5 Covid-19 subvariant found in SA https://t.co/Pj84dJMmOW https://t.co/swPv5yEPOi,1/19/2023 12:51,,IFTTT,FALSE
Bone Research,United States,"Journal of Bone Research Deals with the updated advancement of in the field of Bone, joint& orthopaedics research. We are Open Access,Peer reviewed, publishers.",12/22/2016 12:29,679,1081,229,FALSE,"Despite intensive public health efforts to grind the COVID-19 pandemic to a halt, the recent emergence of the highl… https://t.co/KVlvRG6JB4",1/19/2023 12:45,,Twitter Web App,FALSE
newsnote,South Africa,"An online news site with extensive coverage across the country and around the globe, backed by seasoned journalists.",8/13/2015 12:23,2059,443,324,FALSE,Update: Second case of XBB.1.5 Covid-19 subvariant found in SA https://t.co/SgZH4E48vk https://t.co/DHuXgJrYRM,1/19/2023 12:00,,Twitter Web App,FALSE
Vikram Jha (维克),"New York, USA",We are starting clinicaltrials of our rapid #Covid19 screening platform in China & US. 我们正在中国和美国启动针对#Covid-19 快速筛查平台的声音生物标志物的临床试验 invinciblejha@med-mastodon.com,9/11/2009 13:20,2007,5000,16496,FALSE,FAQ on COVID-19 subvariant XBB.1.5: What is it? Where is it prevalent? How does it differ from Omicron? Does it cau… https://t.co/5wHOqJtbmd,1/19/2023 11:41,,Twitter for Android,FALSE
WTF,,"NO PERSONAL DMs Democrat ‘For all the sad words of tongue and pen, The saddest are these, It might have been'.JG Whittier.",12/2/2016 13:25,18297,13407,114865,FALSE,"What to know about XBB.1.5, a new and highly transmissible COVID-19 subvariant | PBS NewsHour https://t.co/WX0z2fwCee",1/19/2023 10:55,,Twitter for iPhone,FALSE
PBS NewsHour,"Arlington, VA",PBS NewsHour is one of the most trusted news programs on TV and online.,4/18/2008 21:57,1203712,95838,19391,TRUE,XBB.1.5 is arguably the most genetically rich and most transmissible SARS-CoV-2 omicron subvariant yet. https://t.co/2d6Sv1kdI8,1/19/2023 10:47,,Sprout Social,FALSE
Dimsumdaily Hong Kong,Hong Kong,Leading international English news blog which reports breaking news in  Hong Kong and around the world.,9/8/2019 11:59,4232,44,6,FALSE,"HK logs 4,015 COVID-19 cases today, 2 more local XBB.1.5 subvariant cases reported, 45 more patients pass away https://t.co/HQ0dwh7Hkd",1/19/2023 9:57,,Zapier.com,FALSE
Microbes.info,Earth,"Tweeting and RT-ing microbiology news, articles and comments relevant to aspects on bacteria, fungi, viruses and other microbes / microorganisms. Microbes are 💪",4/12/2019 20:42,1504,516,15774,FALSE,"What to know about #COVID-19 #coronavirus #omicron XBB.1.5 #variant ... 

| #COVID19 | #mutant | #PublicHealth |… https://t.co/kUjStzVi79",1/19/2023 8:00,"['COVID', 'coronavirus', 'omicron', 'variant', 'COVID19', 'mutant', 'PublicHealth']",Buffer,FALSE
Kashmir Watch,Jammu & Kashmir,"Gar firdaus bar-rue zamin ast, hami asto, hamin asto, hamin ast- If there is a heaven on earth, it’s here, it’s here, it’s here.",1/11/2022 8:32,110,47,54,FALSE,"#Omicron XBB.1.5 strain is fast spreading across the globe. As per a recent study, the #COVID variant is 63 times l… https://t.co/XlgRJvCdvj",1/19/2023 7:46,"['Omicron', 'COVID']",Twitter Web App,FALSE
Vigilant Violet,,"Wear a damn mask.
#Resist
#BLM
 I stand with Ukraine 

I am #TheResistance fighting for our Democracy!
NO DM's",1/31/2017 5:15,5128,5103,179467,FALSE,"@typo_cat Why take any chances? There are still other variants of COVID out there.
You must keep up with your boost… https://t.co/jQWhv1WKpj",1/19/2023 5:44,,Twitter Web App,FALSE
ActivistBowen: #PFIZER X 4,Hong Kong,"person, brother, son, friend; #COVID19 IS SERIOUS; GET FOUR DOSES!!! #GETVACCINATED #DOUBLEBOOST...,it's the RIGHT thing to do for #SOCIETY",6/8/2011 20:17,4349,4909,5817,FALSE,"3. a) ,...here in #HONGKONG #HK, even under RELAXED PROTOCOLS, we're UNDER 4000 cases/day: https://t.co/4Zrh4NCB4Y.… https://t.co/0GteNaJosU",1/19/2023 5:25,"['HONGKONG', 'HK']",Twitter Web App,FALSE
JoshuaGreen,,"interests include: math, computer science and programming, physics, chess, and puns",3/21/2019 2:01,80,184,5821,FALSE,@DrEliDavid Poor phrasing.  The full post is https://t.co/HbYUXytDLL and the reference to those who already had COV… https://t.co/G2LJSthdTh,1/19/2023 2:50,,Twitter Web App,FALSE
Kheir Clinic,"3727 W 6th St. LA, CA 90020","We provide free & low-cost healthcare to underserved & uninsured communities in Bengali, English, Korean, Spanish & Thai. 
Located in Koreatown, Los Angeles.",6/27/2011 17:06,493,397,487,FALSE,"As the Omicron subvariant, XBB.1.5 is increasing, stay up to date on your vaccines to protect yourselves and your l… https://t.co/4xOMV1L15y",1/19/2023 2:00,,Hootsuite Inc.,FALSE
Cambridge Times,"Cambridge, Ont.","Your community newspaper in Cambridge, Ont. We can be found at 475 Thompson Dr., units 1 to 4, Cambridge, Ontario – postal code is N1T 2K7.  519-623-7395.",11/10/2009 16:03,7816,328,204,FALSE,Canada appears to be in for another wave of COVID-19 cases and associated hospitalizations as a new surge of the vi… https://t.co/NtgGDHbMsG,1/19/2023 0:00,,Buffer,FALSE
NNPBC,"British Columbia, Canada",Nurses and Nurse Practitioners of BC (NNPBC) is professional association representing all of BC's nursing designations.,4/26/2011 21:29,6110,2836,7279,FALSE,"As COVID-19 continues to circulate and new variants such as XBB.1.5 emerge, it is important to do all we can to pro… https://t.co/9yOWaCgcQe",1/18/2023 23:11,,TweetDeck,FALSE
USC,"Los Angeles, CA",The official Twitter account of the University of Southern California. #USC | #FightOn,1/31/2009 8:33,170929,3223,18727,TRUE,Previous infections and vaccinations won't protect from a new subvariant of COVID. A virologist from… https://t.co/mgK264nmei,1/18/2023 23:00,,Sprinklr,FALSE
WDTV 5 News,,"WDTV is the CBS affiliate for the Weston/Clarksburg/Fairmont, West Virginia media market.",1/20/2012 16:55,10106,269,106,TRUE,"XBB 1.5 is the new highly-transmissible omicron subvariant of COVID-19, and according to the CDC, its accounting fo… https://t.co/4brhEhEMYO",1/18/2023 21:45,,SocialNewsDesk,FALSE
Micro Instructor,,For the love of all things micro.,11/2/2009 19:21,153,46,581,FALSE,"Well, looks like we have a new Covid variant circling the globe. But, what do you we know about the XBB.1.5 variant… https://t.co/Ct69QNJOBL",1/18/2023 21:23,,Twitter Web App,FALSE
Resolute Mama,,"It's THE truth, not A truth, not YOUR truth.",2/7/2018 0:48,1434,3462,51139,FALSE,"""XBB.1.5 is the most transmissible form of COVID-19 that we know of to date and may be more likely to infect people… https://t.co/yhqkloufNv",1/18/2023 19:53,,Twitter for Android,FALSE
Bennett Hunter (I am Canadian Libertarian),,"In the age of information ignorance is a choice.
True Liberty requires Evolution, not Revolution.
Follow me on https://t.co/4uQruIgXUq…",3/23/2013 15:41,1114,889,41867,FALSE,"""This suggests that neither monovalent nor bivalent booster vaccines can be relied upon to provide adequate protect… https://t.co/f1HH13W21Z",1/18/2023 19:43,,Twitter Web App,FALSE
Kings County REMO #KingsREMO,"Wolfville, Nova Scotia","We are all responsible for Emergency Preparedness. By failing to prepare, you are preparing to fail -- Benjamin Franklin (Account is not monitored 24/7)",1/23/2015 20:45,827,18,794,FALSE,"2023-01-18 N.L. reports 25 new COVID-19 hospitalizations for first 2 weeks of 2023.
The Health Department also repo… https://t.co/dZGFrAwHUs",1/18/2023 19:41,,Twitter Web App,FALSE
GuelphMercuryTribune,"Guelph, Ontario, Canada",News/events from #Guelph & surrounding areas. Email: newsroom@guelphmercury.com,8/5/2008 18:55,19461,463,159,FALSE,From our network: Canada appears to be in for another wave of COVID-19 cases and associated hospitalizations as a n… https://t.co/3pYU1eB8DG,1/18/2023 19:31,,Buffer,FALSE
Cue Health,"San Diego, CA","Healthcare technology company on a mission to empower people to live their healthiest lives through personalized, proactive, and informed diagnostics.",3/18/2014 22:35,4858,500,532,TRUE,"""Our molecular test can detect emerging #COVID19 variants with a very high degree of accuracy, including XBB.1.5.”… https://t.co/aTJTfN9TNJ",1/18/2023 19:30,['COVID19'],Sprinklr,FALSE
CNECT,"San Diego, CA",Group Purchasing Organization committed to making the process of accessing contracts as seamless as possible.,7/3/2018 14:40,129,573,1372,FALSE,"The XBB.1.5 #subvariant of #COVID19 remains the dominant strain across much of the U.S., including the North East a… https://t.co/LS4FpwAo31",1/18/2023 19:02,"['subvariant', 'COVID19']",HubSpot,FALSE
Unity Health Toronto,"Toronto, Canada","The official account for Unity Health Toronto, comprised of Providence Healthcare, St. Joseph's Health Centre and St. Michael’s Hospital. #BestCareExperiences",1/4/2011 20:12,32994,1156,4002,TRUE,"The COVID subvariant XBB.1.5, known as ‘Kraken,’ will become the next highly-transmissible dominant strain of COVID… https://t.co/nYFbyEULLN",1/18/2023 19:00,,Hootsuite Inc.,FALSE
NHH,"1000 DePalma Drive, Cobourg","Northumberland Hills Hospital. Providing acute, post-acute, outpatient and diagnostic services to west Northumberland.",9/26/2012 21:06,1198,798,2169,FALSE,"COVID-19’s newest subvariant, XBB.1.5 has already caused a global surge in infections. 

As Ontario braces for anot… https://t.co/MY4QFfC2JZ",1/18/2023 18:18,,Twitter Web App,FALSE
Illinois CEAL,,The Chicagoland COVID Collaborative aims to improve COVID-19 vaccination and engagement for low-income Black and Latinx communities.,6/4/2021 13:43,169,272,6305,FALSE,"The latest on XBB.1.5.

https://t.co/4H5NHdtRYs

#COVID19",1/18/2023 18:00,['COVID19'],Hootsuite Inc.,FALSE
Katherine Stiles,"London, GB","Educator, life-long learner, curious scientist, progressive thinker, visionary.
🇺🇸🇪🇺🇬🇧                 ▫️🏛️🎓🔬🧪🧫🧬🧠▫                  🔁≠endorsement",11/16/2021 13:24,621,549,18703,FALSE,FAQ on COVID-19 subvariant XBB.1.5: What is it? Where is it prevalent? How does it differ from Omicron? Does it cau… https://t.co/RHEQSpBXLk,1/18/2023 18:00,,Twitter Web App,FALSE
Durham County Department of Public Health,"Durham, NC","Located in Durham, NC, USA. Working with our community to prevent disease, promote health, and protect the environment. Follow/retweet ≠ endorsement.",4/11/2012 15:31,3863,178,438,FALSE,"XBB.1.5 is a highly transmissible Omicron subvariant of COVID-19, currently the most prominent in the US. Steps to… https://t.co/o8wJ0ZaEPq",1/18/2023 17:12,,Twitter Web App,FALSE
Temerty Medicine,Toronto,"We are solving today’s health issues. Follow us to find out what makes us one of the world’s top med schools and a great place to learn, teach and do research.",10/21/2009 14:28,30482,5117,28150,TRUE,What is the XBB.1.5 subvariant? How does it differ from Omicron? How likely is it to cause serious illness? This Q&amp;… https://t.co/i9UuThFooi,1/18/2023 17:09,,Twitter Web App,FALSE
San Antonio Current,"San Antonio, TX",San Antonio's FREE alternative newsweekly. Editor-in-Chief @Sanford_Nowlin,7/7/2008 14:09,139186,3376,1331,FALSE,"The new XBB.1.5. Omicron subvariant accounts of 80% of new COVID-19 cases in part of the Northeastern U.S., accordi… https://t.co/EmyrQnuRas",1/18/2023 17:00,,TweetDeck,FALSE
Thaddeaus,,Blue collar Red blooded American,5/15/2022 2:54,19,139,958,FALSE,"@DrEliDavid While you laugh, in your dishonesty you didn’t show the whole thing.

“New York City health officials a… https://t.co/fACnH8fasx",1/18/2023 16:58,,Twitter for iPhone,FALSE
madeline yakimchuk 🍁 unama'ki 💗💛💙,"Cape Breton, NS Canada",After 67yrs I'm back where I started. 32yrs of not looking back. 18yrs of being back. No one more surprised than me! They/Them. https://t.co/Np4SBICqBk,1/14/2009 15:39,604,917,13522,FALSE,I've stopped saying it but I still feel it. We are not getting enough covid contextual and comparative data to make… https://t.co/1TAlUngX1K,1/18/2023 16:58,,Twitter Web App,FALSE
Mun,,,12/24/2012 1:31,80,240,696,FALSE,@daveanthony @jimearl666 @TheNarrator000 Omicron subvariant XBB.1.5 now accounts for 73% of all sequenced COVID-19… https://t.co/Qazi87aSGx,1/18/2023 16:41,,Twitter for iPhone,FALSE
Joe Kopera,,GIS & Geology @umassgeo - Former bedrock mapper @massgeol - Cartographer @ https://t.co/AZiVoty07c - disability justice - perpetually grumpy - Nipmuc lands,11/19/2016 23:21,801,796,25861,FALSE,“This suggests that neither monovalent nor bivalent booster vaccines can be relied upon to provide adequate protect… https://t.co/6IwWeABKXM,1/18/2023 16:13,,Twitter for iPhone,FALSE
BCMHouston,"Houston, Texas","Baylor College of Medicine is a health sciences university that creates & applies science and discoveries to further education, healthcare & community service.",4/22/2009 15:19,27006,1903,16981,TRUE,What do we know about the newest COVID-19 variant? Dr. @PeterHotez and other experts share the latest updates.… https://t.co/zUlfx2nBVR,1/18/2023 15:45,,Twitter Web App,FALSE
Djibril Balla Bah,Mali,"ansa-géomecanismes
☆Every human being livs like an island, until comes the day he/she cross the burning water. @GB5E8C3F56°2O3RMCRD☆",1/15/2022 2:32,24,288,305,FALSE,"🔔 WHO COVID-19 Update
Much progress has been made since the start of the pandemic.
However:
• Omicron subvariant, X… https://t.co/jNr1paX27T",1/18/2023 15:43,,Twitter for Android,FALSE
Tufts Medical Center,"Boston, MA",Tufts Medical Center is an academic teaching hospital in Boston.,1/22/2010 19:42,23093,907,2317,TRUE,"Dr. Helen Boucher, #TuftsMedicine's Chief Academic Officer and Dean of @TuftsMedSchool, joined @WCVB to discuss the… https://t.co/SICe4UJpRV",1/18/2023 15:41,['TuftsMedicine'],Hootsuite Inc.,FALSE
Vance Burner ♟🦺♓,East Africa,"2A forever, veteran anachronism, GA DAWGS #1, ❤ blitz chess, Thoreau fan who said “government is best which governs least”, fave book? The Satanic Verses",6/10/2021 6:48,116,230,4500,FALSE,“Omicron subvariant XBB.1.5 now accounts for 73 percent of all sequenced COVID-19 cases in NYC. XBB.1.5 is the most… https://t.co/JvlYWKKrbN,1/18/2023 14:47,,Twitter Web App,FALSE
Pharmacy Practice News,New York,"Pharmacy Practice News is the No. 1-rated independent monthly newspaper providing hard-hitting, timely content to 38,000 U.S.-based health-system pharmacists.",3/24/2011 15:47,6767,1097,1431,FALSE,"Concerns of #Evusheld lacking protection against omicron XBB.1.5. 
https://t.co/sv5ysAh4bM",1/18/2023 14:02,['Evusheld'],Hootsuite Inc.,FALSE
Global New Brunswick,,"Official Twitter account for Global New Brunswick. Follow us for the latest news updates. 

Follow us on Instagram: https://t.co/ojvOYASy5S",3/25/2013 15:32,22314,154,395,TRUE,WATCH: We check in with Dr. Lisa Barrett to find out the latest on the new COVID-19 subvariant XBB.1.5 and what it… https://t.co/A23HMH56ZF,1/18/2023 13:33,,Twitter Media Studio,FALSE
Global Halifax,Atlantic Canada,"Your source for traffic, weather and breaking news from #Halifax and beyond.

https://t.co/9HWMLarkqH",4/14/2009 15:32,92978,451,3266,TRUE,WATCH: We check in with Dr. Lisa Barrett to find out the latest on the new COVID-19 subvariant XBB.1.5 and what it… https://t.co/Xi6ja8iyL8,1/18/2023 13:30,,Twitter Media Studio,FALSE
TWITER CESSPOOL Nyla Hates MAGA,,"Elon Musk’s Twitter Cesspool #BlockTrump✊🏼🌊Anti-GQP🌊🌊🌊Memes, I FB,🚫 DM's💙RESIST,✊🏼LEFTIST, ATHEIST, I BLOCK MAGAgts! Trumpism is Poison☠️#BlueCrew",11/20/2022 14:45,1298,1510,1717,FALSE,"What to know about XBB.1.5, a new and highly transmissible COVID-19 subvariant https://t.co/IXWfIhYaiF",1/18/2023 13:22,,Twitter Web App,FALSE
Teresa MASIA PERALES,"Eaubonne, 95, France",Human rights activist,9/18/2009 17:37,783,959,6961,FALSE,FAQ on COVID-19 subvariant XBB.1.5: What is it? Where is it prevalent? How does it differ from Omicron? Does it cau… https://t.co/bD2MGtzUjK,1/18/2023 12:59,,Twitter for Android,FALSE
THE SMADE JOURNAL,,,10/30/2022 1:01,1,4,0,FALSE,"What to know about XBB.1.5, a new and highly transmissible COVID-19 subvariant | PBS NewsHour https://t.co/12kydpVXhB",1/18/2023 12:42,,Jetpack.com,FALSE
Toronto Star,"8 Spadina Ave, Toronto, Canada","Get the latest news, alerts, sports, photos and more from Canada's largest daily newspaper. ⏩ Instagram: (@)thetorontostar | TikTok: (@)torontostar",1/29/2008 21:38,1188600,604,13741,TRUE,"It’s expected that by Wednesday of this week, about one in five COVID-19 cases in Ontario will be caused by the XBB… https://t.co/wkidC4RbCg",1/18/2023 11:25,,SocialFlow,FALSE
Misbar,"Amman, Jordan",Facts are your friends. Misbar is an independent fact-checking platform that exists to spread accuracy and honesty. submit@misbar.com,4/15/2020 5:11,4279,1,36,FALSE,A senior scientist at the World Health Organization (WHO) has reported that XBB.1.5 is the most transmittable Omicr… https://t.co/RUKbbMXScr,1/18/2023 10:58,,Twitter Web App,FALSE
Dr. Akbar Niazi Teaching Hospital,,"Dr. Akbar Niazi Teaching Hospital (ANTH) is a state-of-the-art 500-bedded hospital, owned by Islamabad Medical & Dental College.",3/24/2019 7:32,314,13,18,FALSE,The Aga Khan University Hospital (AKUH) has raised the alarm that the most infectious XBB.1.5 #COVID19 subvariant h… https://t.co/6TYwMEyVD7,1/18/2023 10:12,['COVID19'],Twitter Web App,FALSE
Dimsumdaily Hong Kong,Hong Kong,Leading international English news blog which reports breaking news in  Hong Kong and around the world.,9/8/2019 11:59,4232,44,6,FALSE,"COVID-19 cases in HK continue to fall to 3,793 today,  one new local XBB.1.5 subvariant recorded, 56 patients pass… https://t.co/nW5IO4unUJ",1/18/2023 8:53,,Zapier.com,FALSE
Howard Bailey,,Christian father enCOURAGEr THINKER communicator teacher athlete #PhotoJournalist bilingual: English-français IT Pro: Mac iPad iPhone expert; Android Windows AV,3/31/2009 3:48,206,1219,9401,FALSE,“#HighlyTransmissible extensively #DrugResistant &amp; profoundly #ImmuneSystem-evading XBB.1.5 SARS-CoV-2 #Subvariant… https://t.co/kkEZTJgdkk,1/18/2023 6:53,"['HighlyTransmissible', 'DrugResistant', 'ImmuneSystem', 'Subvariant']",Twitter for iPad,FALSE
Gregg Burke,,,9/28/2022 11:44,131,405,698,FALSE,"@AOC ""Omicron subvariant XBB.1.5 now accounts for 73% of all sequenced COVID-19 cases in NYC. XBB.1.5 is the most t… https://t.co/jpoOK1I5aJ",1/18/2023 4:49,,Twitter Web App,FALSE
Patrice Boivin 🇨🇦,,on Mastodon @patriceboivin@mastodon.sdf.org,1/26/2009 16:52,369,1040,42729,FALSE,"What to know about XBB.1.5, a new and highly transmissible COVID-19 subvariant https://t.co/IDSZL8cmU0 Well first t… https://t.co/4xemFE1VG0",1/18/2023 3:45,,Twitter Web App,FALSE
"Celeste Kenney, NCC, MS","Georgia, USA","☆ @Celestial_Bean@newsie.social ☆ I support facts, research & science Pro-Mitigation strategies for SARS-CoV-2 • Progressive Christian • Democrat 💙 •",6/28/2011 4:34,1543,5011,49062,FALSE,"@NancyK07312478 @BenMazer @DrLeanaWen • How XBB.1.5, the latest COVID-19 subvariant, is shaping the course of the p… https://t.co/p2ePA7vMD0",1/18/2023 3:18,,Twitter for Android,FALSE
__peroon3__,,,4/24/2017 23:35,16,58,16,FALSE,The XBB.1.5 subvariant — nicknamed 'Kraken' — is arguably the most genetically rich and most transmissible SARS-CoV… https://t.co/1jmnUaExg2,1/18/2023 3:11,,IFTTT,FALSE
Dr. Syra Madad,NYC 🗽,Infectious Disease Epidemiologist▪️Sr Director Special Pathogens @NYCHealthSystem▪️Faculty @TheNETEC @BUCEID▪️Fellow @BelferCenter,12/26/2010 16:31,70598,1106,9261,TRUE,"“Although the highly transmissible omicron subvariant XBB.1.5 is gaining prevalence nationwide, COVID-19 cases are… https://t.co/mPXfcbA6KX",1/18/2023 2:43,,Twitter for iPhone,FALSE
